Page,Title,Type,Location,Size,Price,Links,Description
4,Store for sale 266m with outdoor 127m in SideWalk Mall - New Cairo,Stores,New Cairo,359 M²,"24,087,500EGP",https://aqarmap.com.eg/en/listing/2725964-projects-sidewalk,"Sidewalk Mall Sidewalk Mall attracts those who are looking for a distinctive location to open their business, ensuring satisfactory profits from the beginning, along with the presence of many services that meet the needs of both visitors and customers.KVRD, when implementing the Side Walk project, took care that visitors would be able to reach the shops, and move between them easily, in addition to the wonderful design that characterizes the Side Walk, both from the inside and the outside.Details of Sidewalk Mall in New Caio Sidewalk Mall includes a variety of shops, in addition to multiple dining options as well as contains exciting entertainment areas, all of which are ideal for business and leisure.It is strategically located in one of the most densely populated areas in New Cairo and is surrounded by a group of the finest residential projects. It is also located near the American University in Cairo, which makes many students and families flock to it.Development Company of SideWalk project: A Joint Venture between OUD and KVRDThe Side Walk Mall is a joint venture between OUD and KVRD. The company supports a wide range of projects and is interested in providing amazing results in meeting the diverse real estate requirements across various sectors. The company is also currently working on establishing its own distinctive projects, including residential and commercial properties.Location of the Sidewalk MallThe Sidewalk project is distinguished by its strategic location in the Golden Square area in New Cairo, which guarantees the access of many customers to it. It is also surrounded by many high-end residential projects, all of which are factors that increase the profits of commercial projects that can be established in it. Its proximity to the American University in Cairo also helps attract undergraduates, as well as families and employees of surrounding companies.Areas of Real estate Units in Sidewalk Mall in New CairoSide Walk includes a group of commercial units of various areas, as it contains stores ranging in size from 359 m² to 1712 m², so it is suitable for large and small projects.Features of Sidewalk MallThere are many reasons why customers choose Sidewalk mall in new cairo as a home for their projects, including:It has a large area of ​​6100 square meters, which includes many services and various commercial units.Integration of Sidewalk strip shopping malls with outdoor entertainment facilities.There are places to eat to suit all tastes.Strategic location near the American University in Cairo, German University in Cairo, FUE, and CIC.It provides a lot of transportation near it, thanks to its location on one of the important roads in New Cairo, which will have the main roads leading to the destination of the new capital.There are many high-end residential projects around it.Services Available in Sidewalk MallThis project provides all the services and facilities that facilitate the workflow for project owners, as well as for its visitors. The most prominent of these services are:Availability of storage spaces that shop owners can use to store their goods.Cleaning services provide waste bins everywhere.Security and guarding services that operate around the clock, distinguished by their high accuracy, thanks to the use of professional guards as well as modern surveillance cameras.Availability of property management service upon request.ATMs and banking services that facilitate the purchase and withdrawal process while shopping for visitors.Payment Systems for units in Sidewalk MallThere are two systems for purchasing units in Side Walk, where the company that owns the project offers various payment facilities, represented in: paying 50% of the unit value, and in installments over two years, or paying 35% and paying the rest in installments over 3 years, provided that the units are delivered fully finished.Prices of Units in Sidewalk MallShops are available at the best prices in Sidewalk mall. These prices vary from one unit to another according to its area, its location in the mall, the services you benefit from, the facilities available in it, as well as the view it overlooks.Also, prices are subject to change due to fluctuations in the real estate market in general.About New CairoIf you want to know some information about New Cairo before starting your project there, here are the following points:New Cairo is strategically located between Maadi and Heliopolis, two of the most affluent residential areas in Greater Cairo.It includes many diverse services, from shopping centers and entertainment venues to schools and universities.It can be accessed through many main roads and bridges such as: the Ring Road, Moshir Tantawy Axis, Tahrir Square, New Cairo Road, and 6th of October Bridge.Its international educational institutions are diverse, such as: The British International College in Cairo, the American International School in Egypt, the New Cairo British International School, the International School of Choueifat, the Canadian International School in Egypt, and the American University in Cairo, German University in Cairo, and Future University in Egypt.It includes many entertainment areas in New Cairo, such as Cairo Festival City Mall, Downtown Mall, Porto Cairo Mall, and more."
4,"Apartment for sale in Fifth Settlement in Mountain View iCity, with installments over 7 years",Apartments,"ماونتن فيو أي سيتي, كمبوند بالتجمع الخامس",110 M²,"2,000,000EGP",https://aqarmap.com.eg/en/listing/3161175-for-sale-cairo-new-cairo-compounds-mwntn-fyw-y-syty,"Start a new life full of distinction and luxury and own your home in the finest compounds in the Fifth Settlement, Mountain View ICity- Apartment area: 110 square meters- 10% down payment and installments over 7 years without interest- Price: 2.000.000 EGPConsisting of :- 2 bedrooms - 2 bathrooms - reception - kitchenThe location of Mountain View iCity Compound, Fifth Settlement:Mountain View i city compound is one of the modern and distinguished projects affiliated to Mountain View Development and Real Estate InvestmentThe compound contains all the services that an individual dreams of, the most important of which is the distinguished geographical location in the city of the future, as it is 15 minutes away from my city and the American University- 7 minutes from the entrance to Rehab15 minutes from the American UniversityRight in front of my city- 15 Minutes From Nasr City- 15 minutes from Heliopolis- 10 minutes from the new administrative capitalMountain View iCity Compound Services, Fifth Settlement:- Wide green areas - swimming pools- 24 hour security - private parking for the residents of the compound- Gardens - Artificial Fountains- Cafes and restaurants - Commercial area- club house- Gym and Spa - BBQ and party areas- Quiet areas amidst green spaces - Medical centers"
4,Apartment for sale 170m in Emmar Mivida New Cairo,Apartments,New Cairo,170 M²,"7,523,888EGP",https://aqarmap.com.eg/en/listing/2730635-projects-mivida,"Mivida New Cairo is a unique architectural experience provided by Emaar Misr to its customers in Egypt.As it is an integrated community that offers all amenities and luxury, the project is established in accordance with top of the line international standards and internationally approved sustainability policies.Details of Mivida New CairoMivida is also the first environmentally friendly compound in New Cairo, inspired by city designs in California State in the United States of America. The area of ​​the Mivida Compound in New Cairo is approximately 860 acres, with a large percentage of greenery areas. The project includes various residential units, private villas, apartments, studios, apartments with a garden, twin houses and administrative offices, with different spaces for each type that suit all the needs of families, individuals and companies.With a high level of professionalism, Emaar Misr brought out this project in New Cairo, with a set of distinguished services and distinctive styles.In addition to the Boulevard area, international shopping area, there is a wide range of the most luxurious shopping stores in Mivida, in addition many entertainment areas.Real Estate Developer of Mivida CompoundMivida Compound in New Cairo is owned by Emaar Misr, one of the leading companies in the field of construction and urban development in Egypt and the Arab world, with branches in many Arab countries, America and Europe.Emaar Misr was founded in Egypt in 1997 and started to rise up as a main partner in the largest urban projects, and became one of the most important real estate developers in Egypt.The company has won many awards in recognition of its successes in residential and other projects, including the AL-Kotla Al Zahabiya Award for the best international site plan in 2015, and many other real estate awardsEmaar Misr is also one of the most important companies that have a prominent societal role, especially towards the housing crisis, as it launched in 2018 Beyout Al-Khair project, whose first phase of restoration and rehabilitation of 1,000 housing units ended, and its second phase was launched to contain more units for upcoming generations.Previous Works of the Developing CompanyEmaar Misr has launched many luxurious projects in Egypt, through which it was able to gain the confidence of customers, and portray a wonderful image as one of the most important real estate developers in Egypt in the past years. The company has constructed many projects in Lebanon, the U.A.E, India, Morocco and Pakistan. Among the most important works of Emaar are:-Cairo Gate in Sheikh Zayed compound-Uptown Cairo Mokattam compound-Marassi North Coast-Mivida Fifth SettlementLocation of Mivida Compound Mivida Compound is located in the heart of New Cairo, directly on 90th Street near the American University, and about 20 minutes away from Cairo International Airport, Suez Road, and Ain Sokhna Road.Areas of Units in Mivida New Cairo-The areas of the apartments start from 191 square meters up to 229 square meters, 230, 233 square meters and 244 square meters-Twin houses areas start from 277 square meters up to 285 square meters, 331 square meters and 348 square meters-The areas of villas start from 331, 500 square meters, 511 square meters, 521 square meters, 738 square meters, 739 square meters, 770 square meters and 779 square metersDesign of Mivida New Cairo Mivida Compound New Cairo was designed to include four different areas; each area enjoys its own features and components. The twin house area is surrounded by gardens and has a private club, hotel and medical center, with a variety of residential apartments, administrative offices and schools.As for the villas areas, it has an industrial lake area with luxurious villas, shopping complex, a sports club, an international school and a medical center.The apartment’s area is characterized by an industrial lake in the middle of buildings in addition to a commercial shopping center, a medical center, a school and commercial units.An area in the compound was designated for the administrative units, separate from the rest of the areas, including a parking lot, a security center, large commercial complex, a lake, and a medical center.Services of Mivida Compound As it puts the customer as its top priority, Emaar Misr has been distinguished in providing the most luxurious services within its various projects, whether tourism, residential, administrative and commercial projects. Mivida Compound in New Cairo: many services come with an European taste that is designed to make life within Mivida Compound more easy, elegant and luxurious.The most important services offered by Mivida compound are:-Green areas-A clubhouse that is regarded as an ideal place for relaxation and comfort-A gym designed to accommodate all kinds of individual and team sports as well as social activities-A global commercial area, which is the Boulevard area, that offers shops of all international brands-A private area of ​​lakes with a wide range of activities for families in addition to stunning views that offer an exceptional outdoor experience-International schools of all kinds, the most famous of which are Repton British School & ESNK German School-Eterna Medical Center, the first medical center in Egypt that combines a hospital and multi-specialty clinics, in addition to medical laboratories and pharmacies-Walking, running and cycling routes-Garages for all units-Large parking lots-Public facilities at the highest level of efficiency and quality-A central park on an area of ​​30 acres to suit all residentsPrices of Units at Mivida New CairoPrices of units in Mivida are:-Studio: The price per square meter starts from EGP 30,000 up to EGP 35,000 -Offices: The price per square meter starts from EGP 9,000-Residential apartments: the price per square meter starts from EGP 28,000 up to EGP 35,000-An apartment with a garden: the price per square meter starts from EGP 46,000 and up to EGP 55,000-Twin House: The price per square meter starts from EGP 34,000 up EGP 40,000.-Private villas: the price per square meter starts from EGP 50,000 up to EGP 60,000-I villa: the price per square meter starts from EGP 42,000 and reaches EGP 50,000Payment System in Mivida Compound, New CairoYour decision to purchase and invest in Mivida Compound is the best promising investment opportunity at present especially with the inauguration of the New Administrative Capital next year, and the beginning of transferring employees who will need units that are nearby the capital, and New Cairo in the nearest cities to the Administrative Capital.There are many payment systems for the units of the Mivida project that suit every customer, where the reservation starts from 5% and a payment period of 8 years."
4,Shop 70m for sale Capital mall Zayed,Stores,El Sheikh Zayed,70 M²,"3,500,000EGP",https://aqarmap.com.eg/en/listing/2800043-projects-capital-mall,"Capital Zayed Mall: Your Project is Near Your Target AudienceSheikh Zayed includes many residential compounds, which are inhabited by many families from the middle, above-middle and high-end classes. Therefore, the city is the perfect place to build investment commercial centers and malls. Capital Mall is one of the latest malls in Sheikh Zayed, and includes commercial units and various shops.El Manara Developments is the developer of the Capital Mall and is a prestigious company in the field of real estate development. The Company has previous large projects in the 6th of October and Sheikh Zayed. Given the Company's extensive experience in this field, it has managed to attract businessmen and investors to buy commercial and administrative units in the Mall.Commercial Facades and Distinctive Services in Capital MallThe Capital Mall has luxurious commercial facades capable of attracting the attention of the visitors to the area. So, the demand for the Mall's shops and stores would be increazed . The Mall also provides many entertainment services, which ensure that customers will enjoy and spend quality time. The owner company targets to make Capital Mall the first shopping destination for the residents of Sheikh Zayed City, 6 October City and the surrounding areas.Details About Capital MallEl Manara Developments Company has provided a new concept for commercial malls, as it provides the latest interior designs, attractive decorations, and ease of transportation within the Mall. The Company also provides all the basic and recreational services to provide an enjoyable purchasing experience for the customers.El Manara Developments Company chose a privileged location to establish the Mall near high-end residential compounds inhabited by thousands. These compounds include Karma Compound and El Yasmeen Compound. The Mall is also close to Zayed Main Park and Sawiris Towers.Capital Mall includes commercial and administrative units of multiple areas to suit the needs of all small, medium and large companies. There are also retail areas and large spaces that fit all international and local brands.Capital Mall extends over an area of ​​2,400 square meters. The building area occupies 25% of the total mall area, and green spaces, basic and recreational services occupy the rest of the area. El Manara Developments has provided many distinctive services in the Mall to attract customers and increase the profits of investors. The Mall includes a kids area, electric elevators, cleaning services, and periodic maintenance throughout the Mall. There are also private garages for cars of visitors, security services, and protection systems.The Real Estate Developer of Capital MallEl Manara Developments is a reputable and pioneering Egyptian company in the field of real estate investment and development. The Company aspires to change the concept of commercial, administrative and residential projects in Egypt, and to leave an imprint in the field of investment. The Company has a long experience of more than 20 years in the Egyptian market. During these long years, it has managed to maintain its main values ​​and objectives, i.e. credibility, development, teamwork, diversity and providing huge investment returns to business owners.El Manara Developments is concerned with the satisfaction of its customers, so it targets to deliver all units on time without any delay. The Company uses all high-quality building materials to provide the best investment projects with administrative and commercial units.Previous Developments of El Manara Developments CompanyEl Manara Company uses the best experts, engineers and workers to design and develop its residential and commercial projects. The Company provides high-end projects and integrated resorts with all basic and recreational services, including: Green Land Compound in the 6th of October City.Location of Capital Mall in Sheikh ZayedCapital Mall occupies a prime location near main roads, high-end residential compounds, and near the most important modern projects in Sheikh Zayed City. The Mall is specifically located in the fifth district of Sheikh Zayed City, next to Karma 2 Compound, Zayed Main Park and Al Rabwa Club.Landmarks and Main Roads Near the Capital MallCapital Mall is located near major roads and axes for easy access, such as Nozha Road, 26th of July Axis, and Waslat Dahshur Road. This great location ensures a big audience and more profits for the unit owners in the Mall. The Mall is close to:Cairo University, Sheikh Zayed BranchGlobal Care HospitalZayed Dunes CompoundRiviera CityAl Moez MallRabwah ClubAmericana Plaza MallAl Ahly Sporting ClubTypes of Commercial Units and Properties in Capital MallEl Manara Developments has designed the Capital Mall to suit all activities, shops and companies. The Company has provided an integrated administrative commercial center that includes all basic and recreational services. The Mall includes the following types of units:ShopsAdministrative officesRestaurantsCafesAreas of Units in Capital Zayed ProjectEl Manara Developments has provided different areas to suit all commercial activities and needs. The areas vary as follows:Commercial UnitsThere are various areas for shops, as follows:15 square metres35 square metres45 square metres68 square metres70 square metresAdministrative Units and OfficesThe administrative units and offices in the Mall occupy different areas, as follows:90 square metres92 square metres94 square metres104 square metresDesign of Capital Mall in Sheikh Zayed CityEl Manara Capital Mall has the latest designs that combine simplicity and elegance and features a luxurious entrance to receive visitors.Capital Mall consists of a basement, a ground floor, a first floor dedicated to shops, and the second and third floors for administrative offices and a roof. There are elevators and entrances to the administrative floors for easy access and to prevent congestion.Advantages of Capital MallCapital Mall includes a wide range of advantages that attract visitors, including:The prime location is close to important residential and commercial areas and major roads.Wide green spaces outside the Mall to enjoy scenic views during the shopping experience.A private garage that accommodates a large number of cars.Appropriate payment and installment systems offered by El Manara Developments for customers.Luxurious facades add sophistication to the Mall.Services of Capital MallEl Manara Developments offers many luxurious services within the Mall, including:A wide range of restaurants and cafes serve delicious food and beverages.A firefighting and extinguishing system to maintain the safety of visitors to the Mall.Security and control systems and security gates to protect visitors.A Kids area.Electric elevators for easy transportation within the Mall.Periodic maintenance and cleaning services.Wide corridors and luxurious toilets.Entrance and private elevators for administrative units.Hypermarkets and fast food restaurants.The Price Per Square Meter and Unit Price in Capital MallEl Manara Company offers a competitive price to encourage its customers to invest in the Mall. The price of the units varies according to the area, finishing, and the floor in which the unit is located. Also, prices vary from time to time due to changes in the real estate market. So, you can find the latest price update in the table above.Payment Systems for Units in Capital MallThe units are available in a semi-finished system to allow the owners to complete finishes as they like. El Manara Developments offers the payment system as follows:Paying 50% of the total unit price as a down payment, the remaining 50% is paid in installment over 24 months, and 5% is paid as a maintenance deposit."
4,Apartments For sale in Second Neighborhood,Apartments,"الشطر الثاني, زهراء المعادي",100 M²,"1,050,000EGP",https://aqarmap.com.eg/en/listing/3126749-for-sale-cairo-el-maadi-zahraa-el-maadi-second-neighborhood,Apartments For sale in Second Neighborhood
