Page,Title,Type,Location,Size,Price,Links,Description
4,Villa for sale 327m in Hyde Park - New Cairo,Villas,New Cairo,327 M²,"11,060,000EGP",https://aqarmap.com.eg/en/listing/2466086-projects-hyde-park-new-cairo,"Hyde Park New Cairo is one of the prominent landmarks in the real estate market in Egypt, as it is the first market to introduce the features of being an integrated city, whether in terms of being carried out on a vast area of ​​1200 acres, and a 350 meters height above sea level, or in terms of services and features it possesses. Details of Hyde Park compound New CairoThe compound is uniquely located in the heart of New Cairo near the city's main streets, close to all important government institutions.What distinguishes the project is the diversity of buildings and the multiplicity of spaces, which provides a greater opportunity to choose from several spaces of units ranging from 99 square meters per unit to 327 square meters to suit all needs and requirements of customers.The Real Estate Developer of Hyde Park New CairoThe project was carried out by Hyde Park Properties for Development, one of the leading companies with expertise in real estate development and investment, especially in New Cairo. The company was established in 2011 with a mission to become Egypt’s most valued developer by revolutionising the real estate market and establishing an environmentally and socially-conscious culture. Working in full force, Hyde Park’s dedicated vision has paid off, as the company continues to affirm its positioning its success stories. Hyde Park is jointly owned by an esteemed consortium of Egyptian investment and development companies and institutions, all of which are well-established and highly credible in the local market. Previously known as “Damac Properties for Development S.A.E” The Company was officially renamed to “Hyde Park Properties for Development (HPD) S.A.E.” in May 2011 and has no current ties with Emirati-based “Damac Properties”.Previous Works of the Real Estate Hyde Park Properties for Development Hyde Park Real Estate Development has a group of previous works that prove their credibility and the company’s ability to develop the most luxurious projects that meet the customers’ needs. The most prominent of these projects are:-Coast 82 north coast-The Address Hyde Park, which is a phase of the Hyde Park projectLocation of Hyde Park CompoundHyde Park Compound is located in the southern 90th Street on one side and the Central Regional Road on the other side. It is only 5 minutes away from the American University in Cairo (AUC) and the Future University in Egypt (FUE).The Fifth Settlement is one of the fastest growing areas in terms of construction rate in Egypt, and is distinguished by its villas and palaces, as well as urban diversity between Roman, Islamic, Pharaonic, and modern architecture.Services of Hyde Park New CairoThe compound contains several services, among of which are:-Vast green spaces, in addition to a 145-acre garden-Swimming pools of different sizes for adults and children-Industrial lakes-24/7 Security and guarding services-Private garages-Recreational areas-Restaurants and cafes-Shopping malls-A large sporting club-Health club, gym, and spa-Meditation and relaxation areas-Jogging and walking tracks, and bike trails-Different types of schools-Specialized clinics and medical centersTypes and Areas of Residential Units in Hyde Park Compound The project was implemented on an area of 1200 feddans. 80% of which were allocated for green spaces and the rest for buildings, facilities, and services, where the units vary among studios, apartments, garden-style apartments, duplexes, penthouses, townhouses, and villas.-Studios, with spaces starting from 99 square meters-Apartments, with spaces ranging from 191 square meters up to 233 square meters-Townhouses, with a space starting from 160 square meters up to 248 square meters-Garden-style apartments, with spaces ranging from 160 SM up to 206 square meters-Penthouses, with spaces starting from 205 SM up to 268 square meters-Duplexes, with spaces starting from 216 SM up to 268 square meters-Twin Houses, with spaces ranging from 279 SM up to 300 square meters-Standalone villas, with spaces ranging from 2016 square meters up to 327 square metersDesigns of Hyde Park New CairoThe Hyde Park compound was designed according to the highest international quality standards. Also, all units of the project overlook a panoramic view of the large garden. Moreover, the units were designed with very creative interior designs that took into account all needs of different types of customers.All housing units will be delivered semi-finished, granting each customer the opportunity to put the final touches to his unit.Prices of Units in Hyde Park New CairoThe company offers various types, spaces and prices of units:-Studio prices start from EGP 1,795,000 up to EGP 2,195,000-Apartment prices start from 2,100,000 up to EGP 3,775,000-Garden-style apartment prices start from 2,850,000 up to EGP 4,160,000-Townhouse prices start from EGP 5,170,000 up to 6,045,000-Penthouse prices start from EGP 3,965,000 up to 5,790,000-Duplex prices start from EGP 3,720,000 up to 4,230,000.-Twin house prices starting from EGP 7,885,000 up to 9,000,000Prices Per Square Meters in Hyde Park CompoundHyde Park Real Estate Development has set competitive price plans for all its units, and the prices vary according to the type and space of the units, as follows:-Studio Units: the price per square meter starts from EGP 18,000 up to EGP 22,000-Apartments: the price per square meter starts from EGP 11,000 up to EGP 20,000-Garden-Style Apartments: the price per square meter starts from EGP 18,000 up to EGP 20,000-Townhouses: he price per square meter starts from EGP 32,000 up to EGP 24,000-Penthouses: the price per SM starts from EGP 19,000 up to 22,000-Duplexes: the price per SM from EGP 15,000 up to 17,000-Twin Houses: the price per SM starts from EGP 28,000 up to 30,000-Standalone Villas: the price per square meter starts from EGP 60,000Payment Systems in Hyde Park New CairoHyde Park Developments company offered easy payment methods suitable for all customers to reserve a unit, either for investment or personal use. The methods are as follows:-10% down payment, while paying the rest in installments over 10 years-All units are to be delivered semi-finished, while delivery will be after three years starting from the date of contract"
4,Apartment 273m with roof 120m for sale - The Icon Residence 2 - New Cairo,Apartments,New Cairo,273 M²,"3,371,550EGP",https://aqarmap.com.eg/en/listing/2807330-projects-The%20Icon%20Residence%202,"The Icon Residence 2 - The Icon Residence 2:The Icon was built on 7 acres. It consists of 12 buildings andDifferent units. It wouldn't be our very modern architectural designIt only affects the way people live in our society, howeverThe way the Egyptians lived, too.Developer:• STYLEHOME was founded in 2002 as a real estate developer.• More than 500,000 five hundred thousand square meters of housingCommercial units were delivered.• We are proud to be the only company in the Delta that has completed its workProjects with different architectural styles.• STYLEHOME is a promising, ambitious company that it hopes to be oneOne of the largest real estate development companies in Egypt for this projectIt represents a new challenge for the company and an opportunity for self-realizationIn light of the competition in the region, this is the first project in NeoCairo.Services:Strip MallClub HouseDay careGym and spaService route (about the project)Water and landscape features moreBusiness hall-security systemChildren's areasMATV (central shower)GeneratorsLocation:Our strategic location in New Cairo,Surrounded by many commercial areas so you have toYou will always be connected to the heart of Cairo.The intersection of South 90 Street with American University Street, the western region of the universitiesPayment systems:10% down payment5% after a year10% upon receipt, and the rest for 8 years15% down payment5% after a year10% upon receipt and the rest over 10 yearsThe Delivery:3 yearsSemi finished"
5,Offices in MU7 30 M² Extra super lux For sale,Offices,"MU7, منطقة الأعمال المركزيه",30 M²,"1,200,000EGP",https://aqarmap.com.eg/en/listing/3108565-for-sale-cairo-new-administrative-capital-new-capital-commercial-projects-mwnwryl-twr-y-r-jy-llttwyr-l-qry,Offices in MU7 30 M² Extra super lux For sale
5,Stores Super lux For sale in R1,Stores,"R1, العاصمة الإدارية الجديدة",25 M²,"2,500,000EGP",https://aqarmap.com.eg/en/listing/3108516-for-sale-cairo-new-administrative-capital-new-capital-commercial-projects,Stores Super lux For sale in R1
5,Apartments For sale in Second Neighborhood,Apartments,"الشطر الثاني, زهراء المعادي",130 M²,"1,527,500EGP",https://aqarmap.com.eg/en/listing/3106788-for-sale-cairo-el-maadi-zahraa-el-maadi-second-neighborhood,Apartments For sale in Second Neighborhood
5,"Apartment for sale 240, down payment 117000 EGP, installments over 60 months",Apartments,"الحي الأول, بيت الوطن",240 M²,"1,560,000EGP",https://aqarmap.com.eg/en/listing/3106720-for-sale-cairo-new-cairo-bait-el-watan-first-neighborhood,"Apartment 240 m, front facade, left, nautical, second floor, frequent, near the view zoom, minutes from the administrative capitalThe lowest price per meter - convenient systems for everyoneWith a down payment of 7.5% without interest, in 60 monthsI received an apartment after 18 months, a month from the beginning of the contract,In the most distinguished areas in the first district, Beit El Watan, Fifth Settlement.modern architecture designUnit price 1560000internal division:(Three bedrooms including a master room, dressing room, private bathroom + reception 2 pieces + kitchen + 2 bathrooms)The building is located on a street of 20 m, leading to the services of the neighborhood and the new administrative capital.Sorouh Company is the owner and executor of all its projects in Bait Al Watan.There are no violations at all and they are committed to all the requirements of the device.Delivery of the apartment:A share of the land.Installing a smart home system on the whole house.Slab flat ceilings for easy change of apartment division.Building facades with modern paints that are resistant to weather and moisture factors.Real estate garageElectric garage door.– Alumetal for windows and balconies on the facade.Visible intercom for each apartment.Public surveillance cameras.Central shower.- European lift– Installation and iron gates for architecture.– Entrances and stairs, marble and paints.Air conditioning holders for apartmentsIts internal exchange.The doors of the apartments are armored.- Land scape .Photovoltaic cells.Plumbing and electrical basics.- Rain drainage and equipped air conditioning.home home:Its prime location in New CairoIts building requirements are similar to villas, as the project consists of a ground floor + 3 repeated floorsDistinguished neighborhood division, as each neighborhood has its own integrated services area and the presence of large green spaces within each neighborhoodClose to the best clubs (Al-Ahly, Al-Jazira, Al-Shorta, Platinum Club, and Wadi Degla Club)Bait Al Watan is considered one of the best residential and investment areas in New CairoEasy access to any other residential area inside or outside the Fifth SettlementBait Al Watan area in the Fifth Settlement, surrounded to the north by Suez Road and Nawras HouseTo the east, a group of compounds, including Palm Hills, Mountain View, Al Marasem, and Hilo Park, in addition to the Middle Ring Road and the New Administrative Capital.The largest service areas in the view zone in Beit Al Watan neighborhoodMinutes from North Ninety Street.The project is close to Al Rehab and Madinaty.Entrance from Mohammed bin Zayed Road and the monorail coming from the new administrative capital.- Minutes from Al Ahly Club and Wadi Degla Platinum.Work is underway and the actual implementation of the projects."
5,Apartments For sale in Investors Area,Apartments,"منطقة المستثمرين, العاصمة الإدارية الجديدة",173 M²,"2,000,000EGP",https://aqarmap.com.eg/en/listing/3102080-for-sale-cairo-new-administrative-capital-mntq-lmstthmryn,Apartments For sale in Investors Area
5,Storage For sale in Industrial zone,Storage,"المنطقة الصناعية, القاهرة الجديدة - التجمع الخامس",5060 M²,"30,000,000EGP",https://aqarmap.com.eg/en/listing/3132546-for-sale-cairo-new-cairo-el-maantiqah-el-sinaiyyah,Storage For sale in Industrial zone
5,Apartments For Sale in New Fustat City,Apartments,"الفسطاط الجديدة, الفسطاط",120 M²,"1,128,000EGP",https://aqarmap.com.eg/en/listing/3066847-for-sale-cairo-downtown-el-fostat-lfstt-ljdyd,Apartments For Sale in New Fustat City
5,Apartments For sale in Second Neighborhood,Apartments,"الشطر الثاني, زهراء المعادي",132 M²,"1,419,000EGP",https://aqarmap.com.eg/en/listing/3075697-for-sale-cairo-el-maadi-zahraa-el-maadi-second-neighborhood,Apartments For sale in Second Neighborhood
5,For Sale - Apartments 176 M² Semi Finished in New Fustat City,Apartments,"الفسطاط الجديدة, الفسطاط",176 M²,"1,980,000EGP",https://aqarmap.com.eg/en/listing/3025225-for-sale-cairo-downtown-el-fostat-lfstt-ljdyd,For Sale - Apartments 176 M² Semi Finished in New Fustat City
5,For Sale - Separate Villa 343 M² Semi Finished,Separate Villa,"كمبوند بالشيخ زايد, كمبوند بالشيخ زايد",343 M²,"3,780,700EGP",https://aqarmap.com.eg/en/listing/3015998-for-sale-cairo-el-sheikh-zayed-city-compounds-in-sheikh-zayed-compounds-in-el-sheikh-zayed,For Sale - Separate Villa 343 M² Semi Finished
5,Apartments For sale in District 5 Compound - Marakez,Apartments,"كمبوند ديستريكت 5 - مراكز للتطوير, كمبوند بالتجمع الخامس",154 M²,"3,500,000EGP",https://aqarmap.com.eg/en/listing/3111659-for-sale-cairo-new-cairo-compounds-district-5,
5,Stores For sale in Pyramids Mall,Stores,"بيراميدز مول, مشاريع تجارية بالعاصمة الإدارية الجديدة",25 M²,"2,500,000EGP",https://aqarmap.com.eg/en/listing/3075351-for-sale-cairo-new-administrative-capital-new-capital-commercial-projects-myj-twr-mdn-llttwyr,Stores For sale in Pyramids Mall
5,Corporate Branch 33 M² For Sale in Downtown,Corporate Branch,"الداون تاون, العاصمة الإدارية الجديدة",33 M²,"1,452,000EGP",https://aqarmap.com.eg/en/listing/3030233-for-sale-cairo-new-administrative-capital-ldwn-twn,Corporate Branch 33 M² For Sale in Downtown
5,Separate Villa 300 M² Semi Finished in Compounds In El Sheikh Zayed,Separate Villa,"Compounds In El Sheikh Zayed, Compounds in Sheikh Zayed",343 M²,"3,600,000EGP",https://aqarmap.com.eg/en/listing/3016051-for-sale-cairo-el-sheikh-zayed-city-lshykh-zyd-ljdyd-kmbwnd-mwntny-yfrst-fyw-llttwyr-l-qry,Separate Villa For Sale in Compounds In El Sheikh Zayed with size 300 M² View Main Street
6,Apartments For sale in Avalon,Offices,"افالون, مشاريع تجارية بالعاصمة الإدارية الجديدة",64 M²,"2,105,000EGP",https://aqarmap.com.eg/en/listing/3108821-for-sale-cairo-new-administrative-capital-new-capital-commercial-projects-flwn,Apartments For sale in Avalon
6,"Apartment for sale in Fifth Settlement, immediate receipt, in installments over 7 years, in Galleria Compound",Apartments,"كمبوند جاليريا مون فالي - العربية القابضة, كمبوند بالتجمع الخامس",125 M²,"2,206,000EGP",https://aqarmap.com.eg/en/listing/3080960-for-sale-cairo-new-cairo-compounds-galleria-moon-valley,"Apartment in the finest areas of the Fifth Settlement in Galleria Moon ValleyApartment area: 125 square metersWith 25 % Down Payment And 7 years Installments Without Interestimmediate receipt - Price 2,206,000 EGPConsisting of :- 2 bedrooms- bathroom- a kitchen- Reception 3 piecesCompound services:- The compound is integrated with services and facilities, and more than one stage has been delivered- Club and service complex and track for walking and running and track for bikes- Parking under the buildings- Construction percentage: 18%- Swimming pools and artificial lakes- An integrated life located in the Galleria compound"
6,Separate Villa 305 M² Semi Finished in Moon Hills,Separate Villa,"مون هيلز, كمبوند في ٦ اكتوبر",305 M²,"3,000,000EGP",https://aqarmap.com.eg/en/listing/3024051-for-sale-cairo-6th-of-october-compounds-mwn-hylz,Separate Villa 305 M² Semi Finished in Moon Hills
6,Apartments For sale in Northern Tourist Expansions,Apartments,"الحي 300, التوسعات الشمالية",175 M²,"980,000EGP",https://aqarmap.com.eg/en/listing/3186529-for-sale-cairo-6th-of-october-el-tawsaat-el-shamalya-lhy-300,Apartments  For sale in Northern Tourist Expansions
6,Clinic 50m for sale in compound kattameya gate with 7 years installments,Clinics,Kattameya,50 M²,"1,400,000EGP",https://aqarmap.com.eg/en/listing/2920294-projects-kattameya-gate,"Description:Kattameya gate is one of the newest projects of Memaar Al Morshedy in a new addition to the attributes of the architecture market in Egypt, at which the company is constructing it over an area of 43,700 m2, Kattameya Gate provides the concept of perfectness in the elements of building and construction as it is a residential and commercial complex which is located in a unique location in Kattameya and was designed by one of the most talented designers VDP with the latest international design trends to make the complex provide 2 floors as a parking, a commercial ground floor, and 11 repeated floors with a total of 2,479 residential units that varies from 47 m up to 156 m.Kattameya Gate provides the concept of perfection in the elements of building and construction as it is a residential and commercial complex. It provides 2 floors of underground parking, commercial ground floor, and 11 repeated floors with a total of 330 Medical units & 577 Admin units that start from 50 m2.Developer:In 1983, Mohamad Morshedy established Memaar Al Morshedy Company with a clear business strategy to penetrate the real estate development industry. Mr. Al Morshedy employed a strong team of like-minded engineers, who later became known as Degla Real Estate Development, the mainstay of Mithaq Al Morshedy.In the early years, Memaar Al Morshedy launched several multi-family apartment buildings in the Maadi area. Each of these residences offered a unique style and design that has stood the test of time.Memaar Al Morshedy projects presents a new concept of living that provides integrated development projects that combine residential, administrative and commercial buildings in one place to help our customers enjoy a more comfortable lifeLocation:Kattameya Gate is located in a privileged area of the Kattameya district, near from Kattameya road - Ain Sukhna and the Ring Road in front of other masterpiece carried out by Memaar Al Morshedy architecture that you will see yourself “One Kattameya “project.The location allows its resident's easy access to the main roads in Cairo in a few minutes to reach: The fifth statement, Maadi, Nasr City, Heliopolis, Cairo International Airport, The 6th of October City.Residential Payment facilities:7% down paymentInstallments over 90 monthsMonthly installments starting from EGP 3,650Kattameya Business Gate & Kattameya Medical Gate:5% down payment7 Years installment planDown payment starts from EGP 70,000Amenities & Services:Kattameya Gate owners have access to a full range of exclusive services and amenities that include the following: Wellness Fitness Center Spa Restaurants and Cafe Pool and Pool Lounge Concierge Services Security Gym Retail shopsBusiness & Medical  Reception Waiting area Common meeting rooms Facility Management Property Management  Sky Lounge Electricity Generator Conference Room Gym parkingIn Kattameya Gate ... Everything you need, only a few steps from your Home."
