Page,Title,Type,Location,Size,Price,Links,Description
2,Villa for sale 350m in Yaru Compound - New Capital,Separate Villa,New Administrative Capital,350 M²,"6,650,000EGP",https://aqarmap.com.eg/en/listing/2940829-projects-yaru-compound,"Yaru Compound in New Capital Yaru Compound is an integrated residential project and one of the best residential compounds in the New Administrative Capital. It is located in one of the most distinguished areas of the New Administrative Capital. The compound includes a group of distinct residential units of apartments and villas in an attractive and elegant manner, with complete services and facilities and the latest modern technology. The occupancy rate of buildings and facilities does not exceed 19%, and the rest is allocated to green spaces and services.The Real Estate Developer of Yaru New Capital CompoundThe Yaru project is the first project of Atom Global Real Estate Development in the New Administrative Capital, an Egyptian-Emirati-Saudi joint stock company. It is implementing the project in partnership with the Electricity Police General Administration Officers, and in cooperation with some other companies, namely:UAE Perfect Way Companies: It is a group of companies that owns and manages many real estate assets in the UAE, with assets of about 2 billion dirhams, ranging from rented administrative offices, medical centers, commercial facilities and pharmacies.Al-Hassad Company: It is one of the Saudi companies with a history dating back 25 years, and it has built and owned a large number of hotels in Riyadh and Makkah, and has also developed distinguished projects outside and inside the Kingdom of Saudi Arabia, in the United Kingdom, Turkey and others.The Saudi Mina Metal Company: It is a Saudi-Egyptian company, specialized in the work of cladding facades, and it has implemented several towers in Saudi Arabia in addition to the facades of the clock tower.Egyptian Haman Ventures: It is a group of investment companies that manage tourism, commercial and real estate projects.Previous projects for Atom Real Estate DevelopmentAtom has previous real estate projects, including:Real estate development for many projects inside the Kingdom of Saudi Arabia, including a group of the largest hotels located in the Great Mosque of Mecca and Riyadh.The full facades of the clock tower.A group of housing projects in Turkey and England.Location of Yaru Compound New CapitalYaru Compound is located in the New Administrative Capital in a strategic location, specifically in the area R8 - plot H2, next to a number of distinctive compounds, including La Verde Compound, in addition to many strategic and vital areas in the New Administrative Capital.Cities and main roads close to the Yaru Project in the New Administrative CapitalThe compound is located near the Opera House and all the important government institutions in the capital. It is also close to the presidential residence, and is only a few steps away from the diplomatic district and the conference center. It is also located a few minutes from the new Administrative Capital airport and the Bin Zayed axis, and it also overlooks the Green River, and most importantly, its location is close to all roads and transportation, through which it is easy to move to all parts of Cairo and vice versa.The Main Types of Real Estate Units in the Yaru Compound in the New Administrative CapitalThe properties within the Compound in the New Administrative Capital vary between independent apartments, which start with small areas, and standalone villas with large areas that achieve more privacy and independence for their residents.Areas of Real Estate Units in Yaru Compound in the New Administrative CapitalThe areas of apartments range from 70 m² up to 240 m², and the villas' areas range from 202 m² up to 350 m².Design of Yaru Compound in the New Administrative CapitalYaru project is an integrated residential project that includes apartments and villas, on an area of ​​37 acres, with a construction rate of only 19% for buildings and villas, and the rest is allocated to vast green areas and services.Features of Yaru Compound in the New Capital The compound is characterized by a number of factors that distinguish it from other residential projects, including:Its distinguished location is not only because it is in the new administrative capital of Egypt, but also because it is distinguished by its location within the capital itself.The presence of vast green spaces within the compound.It provides all the basic and recreational services that the residents need.The compound has complete infrastructure facilities that are powered by solar energy on an area of ​​50% of the highest buildings.Services available in Yaru Compound in New CapitalAs for the services that the compound provides to its residents, they are:A number of cycling paths are connected to the outdoor bike path around the compound.A comprehensive social club equipped with swimming pools and gymnasium on the latest international styles.Swimming pools for women and games rooms.A shopping center that includes a group of cafes and restaurants.Several supermarkets and pharmacies.Beauty salons.Permanent security and guard staff working within 24 hours.A large number of surveillance cameras that constantly monitor movement inside the compound.Nursery for children.The Price per Square Meter and the Unit in Yaru Compound in the New Administrative CapitalThe unit price within the compound varies according to the floor, the level of finishing, and the location of the unit within the compound, in addition to the constant price changes in the real estate market.Payment Systems for the Properties of Yaru Compound in the New Capital Yaro Compound offers its customers a very easy payment system, as it is possible to book in the compound by paying a 5% down payment and the rest of the installments over a period of up to 8 years.Or pay a 10% down payment and the remaining installments over 10 years in equal installments.In addition to a maintenance deposit of 8% and a garage of EGP 75,000.The health club is also free for a limited time offer.Atom Real Estate Development has announced that the date of receiving the compound in the Administrative Capital will be after 4 years from the date of contracting.Residential Neighborhoods in the New Administrative CapitalThe new capital includes 25 residential neighborhoods, 1.1 million units, 40,000 hotel rooms, and more than 10,000 kilometers of roads. The Ministry of Housing aims to build 25,000 housing units in one residential neighborhood. The unit area ranges from 100 square meters to 180 square meters or more for villas and others.The number of companies working in the construction of the capital reaches 4 major companies, namely the Arab Contractors, Talaat Moustafa, and the Orascom alliance, Allam Sons and Concorde, in addition to other companies that contribute to the implementation of the rest of the works, and the project seeks to attract 7 million people in the first phase only."
2,Shop for sale 33m in Linx - New Capital,Stores,New Administrative Capital,33 M²,"2,925,926EGP",https://aqarmap.com.eg/en/listing/2957992-projects-linx,"Project Description: LINX is the FIRST commercial complex to be delivered in The New Capital! In two years from now, you can drive down the Suez Road and hit the easy access to LINX commercial complex so you can check on your luxurious workspaces, diversified food courts, fresh clinics & international retail shops. LINX tower is an iconic building that is designed as an emblem of exclusivity and functionality for Egypt’s new promising economic future. With its stately outlook and advance facilities, LINX is all about working in style and balancing between work and play with wellbeing at its core. This flourishing and inspiring community offers workplaces that make a bold statement and helps unlock business opportunities and achieve business excellence. It is the ultimate place where creativity flows freely and targets are met easily. Developer:""Founded in 1993 Capriole Group has successfully designed and constructed over 1 billion dirhams worth of high-rise towers, hotels, factories, workshops, educational buildings, warehouses, commercial centers. Powered by innovation, excellence and collaboration between all stakeholders Capriole Group has consistently delivered all projects on time and on a budget to our end consumer’s satisfaction. At CAPRIOLE™ Our multidisciplinary team of architects, developers and engineers pioneer new sustainability, technology, and well-being solutions in Egypt, that will shape the future of how we live, work, learn, and play. The global reach of our business gives us vision and expertise, our local team and partners give us the insights we need to create enduring social and economic value to the communities we build in."" Services:8 Elevators3 entrances (separate entrance for each use)Storage RoomsParking Spots24/7 SecurityHandicapped bathroom on each floorDigital BoardsFood CourtSky Lounge2 plazas front 1300m + back 3000m with seating areasCCTVInternetSolar PanelsWaiting areasKids AreaMeeting RoomsBMSBMUSecurity SystemFirefighting SystemHVACCentral air conditioningPrayer roomsWaste management systemAccess ControlIrrigation systemGeneratorsLocation:Best locations in the MU23 area and the first serviced area in the administrative capital. The project is located on al-amal axis; the current main entrance to the capital from the Suez Road.The axis extends to the financial and business districts, the northern and southern bin Zayed axis, and the regional and middle ring roads. Between 2 residential areas; R2 and R3 so thhe area is surrounded with more than 55,000 residential units. Only 300m to the green river.5 minutes to the financial and business district.5 minutes to the sports city.10 minutes to the medical city.10 minutes to Al Masa Hotel and Opera House.10 minutes to the government financial district.10 minutes to the fairgrounds.15 minutes to the diplomatic quarter.20 minutes from the Fifth Settlement.Payment Plan:Down Payment starting from 10%, installments up to 6 years"
2,شيخ زايد الحي السابع بجانب مدرسة مرفيل انجليزي,Duplex,"El Bostan, Seventh Neighborhood",600 M²,"5,500,000EGP",https://aqarmap.com.eg/en/listing/3190601-for-sale-cairo-el-sheikh-zayed-city-el-hay-elsabeaa-lbstn,فيلا من لمالك دوبلكس اللبيع مساحتها 600متر صافي # 4 غرفه + غرفت الشغاله # غرفت النوم فيها دريسنج قباني+جاكوزي
2,Apartments For Sale in Dejoya Compound - Taj Misr,Apartment with Garden,"كمبوند دي جويا - تاج مصر, كمبوند بالعاصمة الادارية الجديدة",154 M²,"2,440,000EGP",https://aqarmap.com.eg/en/listing/3067063-for-sale-cairo-new-administrative-capital-new-capital-compounds-dy-jwy,Apartments For Sale in Dejoya Compound - Taj Misr
2,Commercial For Sale in Park Lane Compound - Al Attal,Commercial,"كمبوند بارك لين - العتال, R7",54 M²,"5,914,634EGP",https://aqarmap.com.eg/en/listing/3067229-for-sale-cairo-new-administrative-capital-r7-park-lane,Commercial For Sale in Park Lane Compound - Al Attal
2,Factory For sale in Industrial zone,Factory,"المنطقة الصناعية, القاهرة الجديدة - التجمع الخامس",180 M²,"5,500,000EGP",https://aqarmap.com.eg/en/listing/3120339-for-sale-cairo-new-cairo-el-maantiqah-el-sinaiyyah,Factory For sale in Industrial zone
2,Corporate Branch For sale in Cairo Business Plaza - Better Home,Corporate Branch,"كايرو بيزنيس بلازا - بتر هوم, مشاريع تجارية بالعاصمة الإدارية الجديدة",56 M²,"1,960,000EGP",https://aqarmap.com.eg/en/listing/3111697-for-sale-cairo-new-administrative-capital-new-capital-commercial-projects-kyrw-byznys-blz,المطور الاول بالعاصمة الادارية (Better Home) تطرح اكبر مشروع ادارى في الحي المالي Cairo business plaza( New Capital)اكبر مبني ادارى في الحي المالي علي مساحة ٢٥.٠٠٠المباني تم تصميمها طبقا لاشتراطات L.E.E.DGreen Building Certification و هو اعتماد معترف به دوليا كتميز في طريقة التفكير و اعادة تصميم الاماكن بما يخدم البيئة المساحات تبدء مم ٥٦م سعر المتر يبدء من ٣٢.٠٠٠ : ٤٠.٠٠٠ بدون تشطيب ٥٠٠٠ سعر متر التشطيب بشيك منفصل بعد سنة و نصف من التعاقد تسليم الوحدات تشطيب كامل بالتكييف (مركزى)
2,Apartments 130 M² Semi Finished in El Maadi Ring Road,Apartments,"دائري المعادي, المعادي",130 M²,"1,000,000EGP",https://aqarmap.com.eg/en/listing/3183527-for-sale-cairo-new-cairo-el-kattameya-compounds-in-kattameya-kmbwnd-mkny-lmnswr-llttwyr,Area: 130mFourth floor3 bedrooms + 3 bathroomsSemi-finishedGarage shareElevatorImmediate deliveryTwo rooms overlooking the street ( reception - master bedroom )Compound Makani - Al Maadi ring roadOn the entrance to Sokhna road5 mins from New Cairo - 5 mins from Nasr city - 5 mins from Al Maadi
2,For Sale - Separate Villa 430 M² Super lux,Separate Villa,"El Rabwa, Compounds in Sheikh Zayed",430 M²,"16,000,000EGP",https://aqarmap.com.eg/en/listing/3020210-for-sale-cairo-el-sheikh-zayed-city-compounds-in-sheikh-zayed-el-rabwa,Separate Villa For Sale in El Rabwa with size 430 M²
2,Store 110 m ground floor in Kaya Mall - October Gardens,Commercial,October Gardens,110 M²,"5,220,000EGP",https://aqarmap.com.eg/en/listing/2676956-projects-kaya_mall,"Kaya Plaza Mall is one of the most important malls with full services of commercial units, offices and clinics in the 6th of October, affiliated to First Group Real Estate.The acquisition of a unit in the mall to establish your own project is a golden opportunity due to its distinguished location on the most important service areas, which in turn provide visitors to the mall, reasonable prices compared to the prices of new cities such as the Fifth Settlement and Al Rehab, in addition to an easy payment systems that will not make you feel any financial burden, and its unique designs according to the latest model.Details Of Kaya Plaza Mall Project Kaya Plaza Mall is an integrated service project with luxurious designs on the latest model with international standards because it contains green spaces that provide the units with wonderful views and attract visitors to it, and service areas and facilities that facilitate the owners of the units to complete their work in the fastest time.Background Information on the Real Estate Developer of Kaya Plaza Complex First Group is a leading Egyptian real estate corporation that has the fastest growth rate in the Egyptian market among real estate companies. First Group Company is one of the integrated companies that provide lasting value to its employees, customers, partners and shareholders through its commitment to its promises, its credibility in everything it says, and its fruitful experiences that enable it to succeed in all its projects.Among the most important business sectors of First Group are: public-private partnerships, mixed-use projects, multi-family housing, commercial and retail real estate sales, and residential complexes in 6th of October First Company contributes to these projects with its services represented in construction, development and real estate management.Previous Works Of The First Group CompanyThe projects of First Group exist on the 6th of October and Sheikh Zayed with investments amounting to EGP 5 billion. Among its most prominent projects are:1. Kazan Plaza Mall, in front of the Mall of Arabia, on the Gamal Abdel Nasser Corridor, 6th of October2. Kenz , 6th of October3. Kaya Plaza MallAreas of Commercial Units in Kaya Plaza MallThe total area of ​​the Kaya Plaza mall is 12,000 square meters, and it consists of three floors, each role for a specific activity, for example:-The ground floor is dedicated to commercial units in Kaya Plaza Mall with areas starting from 200 square meters-The first floor is for commercial services, but with areas starting from 50 square meters-As for the second and last floor, it includes offices and medical clinics of various sizes suitable for different specialties. The area of units starts from 58 square meters and goes up to 325 square meters-The medical and administrative units in 6th of October shall be delivered with super lux finishes, with the option of choosing the final colors for the finishing available to the owner of the unit, and it is expected that the project units will be delivered ready in October 2021Location of Kaya Plaza Mall in 6th of OctoberAfter the success of Kazan Plaza Mall in October Gardens, First Group was keen in increasing its success by establishing another mall in a privileged location that attracts more residents to it. And thus, raising the purchase rates and investment movement in the mall. So, they were prompted to choose their project location in the Kenz Compound on 6th of October City.Kaya Plaza Mall has a direct view of the pyramids and Fayoum Road, as well as its proximity to the Mall of Egypt with a distance of 10 minutes, Zewail University with a distance of 3 minutes, the Shooting Square with a distance of 5 minutes, and Media Production City - the main destination for residents of the project - 12 minutes away, and Juhayna Square within a distance 15 minutes, which is the destination of students and athletes, which increases the investment value of the mall.The mall is linked to several main roads, preparing it to be a destination for visitors from neighboring cities with a high financial level, the most important of these roads are: the Ring Road, the Oasis Road and the 26th of July Corridor.In addition to its proximity to the most important roads and service centers, it is also adjacent to high-end residential projects such as Dreamland and Ashgar neighborhood.Services of Kaya Plaza Project In The 6th of October City-A children's play area equipped with different games suitable for all ages-Medical clinics in 6th of October and pharmacies that provide excellent medical services-3D cinema provides visitors to the mall with the element of luxury and spending an enjoyable time while shopping-A sports club to encourage business owners to follow a health regime during their work time, as well as to attract visitors looking for a sports center equipped with the latest equipment-Furniture gallery featuring various shapes and tastes-A hypermarket to provide all the basic and entertainment needs, which prevents visitors from going anywhere in search of their requirements-A bank to facilitate financial transactions between companies and businessmen-Car park to maintain the cars of visitors, store owners and real estate in the mall, and to avoid traffic congestion and congestion in front of the mall-Restaurants and cafes areas that serve the most delicious food and enjoy excellent service, including fast food outlets and a dining area seating area-Modern elevatorsPrices of Units in Kaya Plaza Mall in 6th of OctoberFirst Real Estate Group offers competitive prices compared to the quality and magnitude of the facilities and services attached to various types of properties in Kaya Plaza Mall, and excellent designs and finishing materials.The price per square meter inside commercial units for sale in 6th of October in the mall varies according to the type and area of ​​the unit, as the price per square meter in 6th of October in commercial units on the ground floor is EGP 45,000, while the price per square meter in commercial units on the first floor is EGP 35,000. As for the price per square meter for the various units in Kaya Plaza Mall, it ranges between EGP 21,000 and EGP 22,000.Payment Systems For Units in Kaya Plaza MallFirst Group Company was keen on the convenience of the customer and providing all means of payment for the acquisition of a commercial store for sale; the immediate payment system and the annual and monthly installment system are available according to the customer's circumstances.The company provides a system of owning the unit in installments represented by paying 15% as a down payment for the contract, then 0% after 3 months, then pay the rest of the amount over 6 years without interest and start the first installment 6 months after paying the 10%.Services of October Gardens AreaThe October Gardens area is a huge investment for the future, as the city provides apartments in 6th of October of various sizes and finishes for different residential segments as well as basic services to attract residents to constructing and settling in the city.October Gardens enjoys a strategic location near Al Wahat Road, half an hour from 6th of October City and 40 minutes from Sheikh Zayed, and it is also connected to neighboring cities through the Ring Road and Fayoum Road."
2,Offices 32 M² For Sale in Downtown,Offices,"Downtown, New Administrative Capital",32 M²,"736,000EGP",https://aqarmap.com.eg/en/listing/3020508-for-sale-cairo-new-administrative-capital-ldwn-twn,Offices For Sale in Downtown with size 32 M² View Garden
2,Offices in Paragon Mall - Builderia Development 80 M² Lux For sale,Offices,"مول براجون - بلدريا للتطوير, مشاريع تجارية بالعاصمة الإدارية الجديدة",80 M²,"3,200,000EGP",https://aqarmap.com.eg/en/listing/3115376-for-sale-cairo-new-administrative-capital-new-capital-commercial-projects-mwl-brjwn-bldry-llttwyr,"Offices 80 M² Lux View Main Street, third floor, three rooms, one baths"
3,Office for sale 169m in V90 Mall - New Cairo,Offices,New Cairo,169 M²,"8,290,094EGP",https://aqarmap.com.eg/en/listing/2770509-projects-v90-mall,"V 90 Mall:V 90 Mall features many services as it consists of 3 floorsthe indoor area ​​5313 meters, the building area of ​​346 is distributed over 3 floorsAnd 33 unitsDistributors between offices - shops - garages - restaurantsAlso, there are many services such as security and guardingEscalatorsLiftsDeveloper:Urban Development has established itself as the agile growing leader in the industry. Our priority is providing the utmost human experience by capitalizing on luxury and comfort in all of our projects. We are developers who are building community. Our people bring their technical knowledge, expertise, and resourcefulness to the delivery of every construction service we provide in a culture that nurtures nothing but excellence and innovation.Facilities:Security2 Elevators2 EscalatorsPublic ToiletsPrayer RoomService ElevatorStaff LockersF&B Service CorridorStorage AreaCommon Meeting RoomsLocation:V90 mall is at the heart of New Cairo, our premium location lies on North90 St., as part of the commercial area of Katameya Hills compound.ENUE Strategically placed near commercial hubs and Petrosport stadium.Payment systems:2022 delivery dateDelivery: semi finishedPayment Plan: 10% downpayment and installments over 5 years"
